{
  "$schema": "http://json-schema.org/draft-07/schema#",
  "$id": "https://rayact.dev/rayact.config.schema.json",
  "title": "Rayact project configuration",
  "description": "Schema for rayact.config.json. Fields omitted fall back to built-in defaults; only set a field to override a default.",
  "type": "object",
  "additionalProperties": false,
  "properties": {
    "$schema": { "type": "string" },
    "name": { "type": "string", "description": "Cross-platform display name used by generated clients and dev-server discovery." },
    "rayactAppKey": {
      "type": "string",
      "description": "Stable app identifier. Also seeds the container-pack obfuscation key."
    },
    "entry": {
      "type": "string",
      "description": "Entry source file (e.g. src/App.tsx), relative to the project root."
    },
    "platform": {
      "type": "string",
      "enum": ["desktop", "android", "ios", "web"],
      "description": "Deprecated. Use command flags such as --desktop, --android, --ios, or --web."
    },
    "devServer": {
      "type": "object",
      "additionalProperties": false,
      "properties": {
        "host": { "type": "string" },
        "port": { "type": "integer" },
        "cdpPort": { "type": "integer" },
        "strictPort": { "type": "boolean", "description": "Fail if devServer.port is already in use instead of picking the next free port." }
      }
    },
    "android": {
      "type": "object",
      "additionalProperties": false,
      "properties": {
        "package": { "type": "string", "description": "Deprecated Android application id alias. Use packageName." },
        "projectDir": { "type": "string", "description": "Gradle project dir (contains gradlew), relative to project root." },
        "activity": { "type": "string", "description": "Optional fully qualified Android activity class. Defaults to the prebuilt Rayact host activity." },
        "appName": { "type": "string", "description": "Deprecated Android-only display name. Use top-level name." },
        "packageName": { "type": "string", "description": "Android application id used by prebuild, install, and launch." },
        "icon": { "type": "string" }
      }
    },
    "ios": {
      "type": "object",
      "additionalProperties": false,
      "properties": {
        "projectDir": { "type": "string" },
        "bundleId": { "type": "string", "description": "iOS product bundle identifier used by prebuild, install, and launch." }
      }
    },
    "linking": {
      "type": "object",
      "additionalProperties": false,
      "description": "Application deep-link schemes generated into native platform projects.",
      "properties": {
        "schemes": {
          "type": "array",
          "items": {
            "type": "string",
            "pattern": "^[A-Za-z][A-Za-z0-9+.-]*$"
          },
          "uniqueItems": true
        }
      }
    },
    "router": {
      "type": "object",
      "additionalProperties": false,
      "description": "File-based routing (@rayact/router) options.",
      "properties": {
        "appDir": {
          "type": "string",
          "description": "Routes directory relative to the project root. Default \"app\"."
        }
      }
    },
    "nativeModules": {
      "type": "array",
      "description": "Installed native modules autolink automatically. Entries may disable or configure a package. Legacy name/lib/jsPackage objects are accepted with a warning through 0.0.x.",
      "items": {
        "oneOf": [
          { "type": "string" },
          {
            "type": "object",
            "additionalProperties": false,
            "required": ["package"],
            "properties": {
              "package": { "type": "string" },
              "enabled": { "type": "boolean" },
              "configuration": { "type": "object" }
            }
          },
          {
            "type": "object",
            "additionalProperties": false,
            "required": ["name"],
            "properties": {
              "name": { "type": "string" },
              "lib": { "type": "string" },
              "jsPackage": { "type": "string" },
              "platforms": { "type": "array", "items": { "type": "string" } },
              "architectures": { "type": "array", "items": { "type": "string" } },
              "abiRange": { "type": "string" },
              "permissions": { "type": "array", "items": { "type": "string" } },
              "configuration": { "type": "object" },
              "officialDevApp": { "type": "boolean" }
            }
          }
        ]
      }
    },
    "transform": {
      "type": "object",
      "additionalProperties": false,
      "description": "Per-build-mode transforms. Defaults: dev=false, debug=false, release=true.",
      "properties": {
        "minify": { "$ref": "#/$defs/modeFlags" },
        "bytecode": { "$ref": "#/$defs/modeFlags" }
      }
    },
    "pack": {
      "type": "object",
      "additionalProperties": false,
      "description": "Container (.rayactpack) packaging options for release/platform builds.",
      "properties": {
        "include": {
          "type": "array",
          "items": { "type": "string" },
          "description": "Extra (non-standard) file globs to opt into the pack, relative to the project root."
        },
        "obfuscate": {
          "type": "boolean",
          "description": "XOR-obfuscate pack entries with a key derived from rayactAppKey. Default false."
        },
        "maxChunkSize": {
          "type": "integer",
          "description": "Max bytes per pack chunk before splitting. Default 104857600 (100 MB)."
        }
      }
    }
  },
  "$defs": {
    "modeFlags": {
      "type": "object",
      "additionalProperties": false,
      "properties": {
        "dev": { "type": "boolean" },
        "debug": { "type": "boolean" },
        "release": { "type": "boolean" }
      }
    }
  }
}
