{
  "$schema": "../../schema/rayact.config.schema.json",
  "name": "Rayact Dev App",
  "rayactAppKey": "rayact-dev-app",
  "devServer": {
    "host": "0.0.0.0",
    "port": 8083,
    "cdpPort": 9229
  },
  "entry": "src/App.tsx",
  "android": {
    "projectDir": "../android",
    "packageName": "com.rayact.app",
    "icon": "src/assets/icon.png"
  },
  "ios": {
    "projectDir": "../ios",
    "bundleId": "com.rayact.app"
  },
  "nativeModules": [
    "@rayact/mmkv",
    "@rayact/secure-store",
    "@rayact/crash-reporter",
    "@rayact/sensors",
    "@rayact/svg"
  ]
}
